name,url,price,currency,description,ingredients,size,rating,review_count,image_url,brand,availability,category,subcategory,breadcrumbs,tags,search_text
French Toast Scone Mix,https://shop.kingarthurbaking.com/items/french-toast-scone-mix,8.95,USD,"Embrace the traditional taste of rich eggy custard, vanilla, and a hint of maple in our tender French Toast Scones. Made with our finest Vietnamese Cinnamon, Cinnamon Flakes, and nutmeg. Freshly baked homemade scones are quick and easy with our simple scone mixes. Perfect for serving at breakfast, an afternoon snack, for yourself, your family, or your guests. Simply blend, shape, and bake for warm, delicious scones in fewer than 30 minutes.",Ingredients Ingredients Ingredients Extracts & Flavorings Spices & Pantry Fruit Add-Ins & Jams,,4.7,557,https://cdn11.bigcommerce.com/s-ihwnd7z21q/images/stencil/1280x1280/products/549/7177/100210_packagefront__46469_3302__16067.1724079447.jpg?c=1,,InStock,Scones,Scones,"['Shop', 'Mixes', 'Scones', 'French Toast Scone Mix #100210']","['cinnamon', 'scone', 'vanilla']","French Toast Scone Mix Embrace the traditional taste of rich eggy custard, vanilla, and a hint of maple in our tender French Toast Scones. Made with our finest Vietnamese Cinnamon, Cinnamon Flakes, and nutmeg. Freshly baked homemade scones are quick and easy with our simple scone mixes. Perfect for serving at breakfast, an afternoon snack, for yourself, your family, or your guests. Simply blend, shape, and bake for warm, delicious scones in fewer than 30 minutes. Ingredients Ingredients Ingredients Extracts & Flavorings Spices & Pantry Fruit Add-Ins & Jams Mixes Scones Shop Mixes Scones French Toast Scone Mix #100210"
Gingerbread Cake & Cookie Mix,https://shop.kingarthurbaking.com/items/gingerbread-cake-cookie-mix,5.98,USD,"It's always the season for warm gingerbread! Fill your kitchen with nostalgic aromas and create whatever you crave with this one convenient gingerbread mix. Whether you use it to make gingerbread cookies or a gingerbread cake - it's guaranteed to satisfy all your gingerbread cravings! Spiced with molasses, ginger, and cinnamon, it's a classic holiday treat no pantry should be without.",Ingredients Ingredients Ingredients Extracts & Flavorings Spices & Pantry Fruit Add-Ins & Jams,,4.8,1267,https://cdn11.bigcommerce.com/s-ihwnd7z21q/images/stencil/1280x1280/products/585/7371/100313M403J_211574_TraditionalGingerbreadCakeCookie_0721-34__43900_3031__64245.1735930773.jpg?c=1,,InStock,Cookies,Cookies,"['Shop', 'Mixes', 'Cookies', 'Gingerbread Cake &amp; Cookie Mix #100313']","['bread', 'cake', 'cinnamon', 'cookie', 'kit']","Gingerbread Cake & Cookie Mix It's always the season for warm gingerbread! Fill your kitchen with nostalgic aromas and create whatever you crave with this one convenient gingerbread mix. Whether you use it to make gingerbread cookies or a gingerbread cake - it's guaranteed to satisfy all your gingerbread cravings! Spiced with molasses, ginger, and cinnamon, it's a classic holiday treat no pantry should be without. Ingredients Ingredients Ingredients Extracts & Flavorings Spices & Pantry Fruit Add-Ins & Jams Mixes Cookies Shop Mixes Cookies Gingerbread Cake &amp; Cookie Mix #100313"
Gluten-Free All-Purpose Biscuit & Baking Mix,https://shop.kingarthurbaking.com/items/gluten-free-all-purpose-biscuit-baking-mix,6.95,USD,"Stock your pantry with our all-purpose gluten-free baking mix and you're never far from reliably delicious gluten-free baking. Quite possibly the best thing to happen to gluten-free bakers, this mix is ideal for everything from pancakes at breakfast to biscuits with dinner to shortcake for dessert. With 20 grams of whole grains per serving, you can feel good about using it for all your best recipes. Bakers love this mix for how convenient it makes gluten-free recipes, and there's no grittiness or aftertaste. Our mixes are carefully crafted in our test kitchen through meticulous taste-testing (it's a tough job, but we're up to the challenge!) and blending to replicate our favorite recipes. The result? Mixes that make the finest gluten-free baked goods around. Simple ingredients, reliable results, and deliciousness that everyone can enjoy! Discover recipes using Gluten-Free Baking Mix. Click&nbsp;here&nbsp;to learn more about allergens and cross-contact prevention",Ingredients Ingredients Ingredients Extracts & Flavorings Spices & Pantry Fruit Add-Ins & Jams,3 lb,4.7,106,https://cdn11.bigcommerce.com/s-ihwnd7z21q/images/stencil/1280x1280/products/1451/5739/213243_front__73891.1724079463.jpg?c=1,,InStock,Pancakes,Pancakes,"['Shop', 'Mixes', 'Pancakes', 'Gluten-Free All-Purpose Biscuit &amp; Baking Mix #213243']","['biscuit', 'cake', 'gluten-free', 'kit', 'pancake']","Gluten-Free All-Purpose Biscuit & Baking Mix Stock your pantry with our all-purpose gluten-free baking mix and you're never far from reliably delicious gluten-free baking. Quite possibly the best thing to happen to gluten-free bakers, this mix is ideal for everything from pancakes at breakfast to biscuits with dinner to shortcake for dessert. With 20 grams of whole grains per serving, you can feel good about using it for all your best recipes. Bakers love this mix for how convenient it makes gluten-free recipes, and there's no grittiness or aftertaste. Our mixes are carefully crafted in our test kitchen through meticulous taste-testing (it's a tough job, but we're up to the challenge!) and blending to replicate our favorite recipes. The result? Mixes that make the finest gluten-free baked goods around. Simple ingredients, reliable results, and deliciousness that everyone can enjoy! Discover recipes using Gluten-Free Baking Mix. Click&nbsp;here&nbsp;to learn more about allergens and cross-contact prevention Ingredients Ingredients Ingredients Extracts & Flavorings Spices & Pantry Fruit Add-Ins & Jams Mixes Pancakes Shop Mixes Pancakes Gluten-Free All-Purpose Biscuit &amp; Baking Mix #213243"
Gluten-Free Banana Bread and Muffin Mix,https://shop.kingarthurbaking.com/items/gluten-free-banana-bread-and-muffin-mix,7.95,USD,"A gluten-free banana bread so good, it's bananas. The best gluten-free banana bread or banana muffins you'll ever bake, in an easy-to-use mix. We believe in food that's delicious and that you can feel good about, so we start with the best ingredients around to make a moist, superior banana bread with the classic flavor you love. Our mixes are carefully crafted in our test kitchen through meticulous taste-testing (it's a tough job, but we're up to the challenge!) and blending to replicate our favorite recipes. The result? Mixes that make the finest gluten-free baked goods around. Simple ingredients, reliable results, and deliciousness that everyone can enjoy! Click&nbsp;here&nbsp;to learn more about allergens and cross-contact prevention",Ingredients Ingredients Ingredients Extracts & Flavorings Spices & Pantry Fruit Add-Ins & Jams,,4.9,209,https://cdn11.bigcommerce.com/s-ihwnd7z21q/images/stencil/1280x1280/products/1277/4991/10546G201H_211423_GFBananaBreadMuffin_1220-3qtr__02954__07038.1724079462.jpg?c=1,,InStock,Muffins &amp; Quick Bread,Muffins &amp; Quick Bread,"['Shop', 'Mixes', 'Muffins &amp; Quick Bread', 'Gluten-Free Banana Bread and Muffin Mix #310546']","['bread', 'gluten-free', 'kit', 'muffin']","Gluten-Free Banana Bread and Muffin Mix A gluten-free banana bread so good, it's bananas. The best gluten-free banana bread or banana muffins you'll ever bake, in an easy-to-use mix. We believe in food that's delicious and that you can feel good about, so we start with the best ingredients around to make a moist, superior banana bread with the classic flavor you love. Our mixes are carefully crafted in our test kitchen through meticulous taste-testing (it's a tough job, but we're up to the challenge!) and blending to replicate our favorite recipes. The result? Mixes that make the finest gluten-free baked goods around. Simple ingredients, reliable results, and deliciousness that everyone can enjoy! Click&nbsp;here&nbsp;to learn more about allergens and cross-contact prevention Ingredients Ingredients Ingredients Extracts & Flavorings Spices & Pantry Fruit Add-Ins & Jams Mixes Muffins &amp; Quick Bread Shop Mixes Muffins &amp; Quick Bread Gluten-Free Banana Bread and Muffin Mix #310546"
Gluten-Free Bread and Pizza Mix,https://shop.kingarthurbaking.com/items/gluten-free-bread-and-pizza-mix,7.95,USD,"We spent years perfecting our Gluten-Free Bread and Pizza Mix, and the results are impressive. It looks and slices like traditional wheat flour without any grittiness or aftertaste. Easy to prepare, our mix yields superior results every time and can easily be used to make gluten-free bread and gluten-free pizza. Our mixes are carefully crafted in our test kitchen through meticulous taste-testing (it's a tough job, but we're up to the challenge!) and blending to replicate our favorite recipes. The result? Mixes that make the finest gluten-free baked goods around. Simple ingredients, reliable results, and deliciousness that everyone can enjoy! Click here to learn more about allergens and cross-contact prevention",Ingredients Ingredients Ingredients Extracts & Flavorings Spices & Pantry Fruit Add-Ins & Jams,,4.7,229,https://cdn11.bigcommerce.com/s-ihwnd7z21q/images/stencil/1280x1280/products/1264/8956/07500G205G_212249_GFBreadPizza_1000x1000_051625__53509.1747409074.jpg?c=1,,InStock,Bread,Bread,"['Shop', 'Mixes', 'Bread', 'Gluten-Free Bread and Pizza Mix #307500']","['bread', 'gluten-free', 'kit', 'pizza']","Gluten-Free Bread and Pizza Mix We spent years perfecting our Gluten-Free Bread and Pizza Mix, and the results are impressive. It looks and slices like traditional wheat flour without any grittiness or aftertaste. Easy to prepare, our mix yields superior results every time and can easily be used to make gluten-free bread and gluten-free pizza. Our mixes are carefully crafted in our test kitchen through meticulous taste-testing (it's a tough job, but we're up to the challenge!) and blending to replicate our favorite recipes. The result? Mixes that make the finest gluten-free baked goods around. Simple ingredients, reliable results, and deliciousness that everyone can enjoy! Click here to learn more about allergens and cross-contact prevention Ingredients Ingredients Ingredients Extracts & Flavorings Spices & Pantry Fruit Add-Ins & Jams Mixes Bread Shop Mixes Bread Gluten-Free Bread and Pizza Mix #307500"
Gluten-Free Chocolate Cake Mix,https://shop.kingarthurbaking.com/items/gluten-free-chocolate-cake-mix,8.95,USD,"This delicious, rich cake just happens to be gluten-free, but we've never met anyone who can ever resist a slice. With a tender and moist texture and an intense, oh-so-chocolatey flavor, this mix is your go-to for birthdays and special occasions. Our mixes are carefully crafted in our test kitchen through meticulous taste-testing (it's a tough job, but we're up to the challenge!) and blending to replicate our favorite recipes.The result? Mixes that make the finest gluten-free baked goods around. Simple ingredients, reliable results, and deliciousness that everyone can enjoy! Click here to learn more about allergens and cross-contact prevention",Ingredients Ingredients Ingredients Extracts & Flavorings Spices & Pantry Fruit Add-Ins & Jams,,4.9,212,https://cdn11.bigcommerce.com/s-ihwnd7z21q/images/stencil/1280x1280/products/1266/4937/gluten-free-chocolate-cake-mix__29612__40253.1724079467.jpg?c=1,,InStock,Cake &amp; Pie,Cake &amp; Pie,"['Shop', 'Mixes', 'Cake &amp; Pie', 'Gluten-Free Chocolate Cake Mix #307505']","['cake', 'chocolate', 'gluten-free', 'kit']","Gluten-Free Chocolate Cake Mix This delicious, rich cake just happens to be gluten-free, but we've never met anyone who can ever resist a slice. With a tender and moist texture and an intense, oh-so-chocolatey flavor, this mix is your go-to for birthdays and special occasions. Our mixes are carefully crafted in our test kitchen through meticulous taste-testing (it's a tough job, but we're up to the challenge!) and blending to replicate our favorite recipes.The result? Mixes that make the finest gluten-free baked goods around. Simple ingredients, reliable results, and deliciousness that everyone can enjoy! Click here to learn more about allergens and cross-contact prevention Ingredients Ingredients Ingredients Extracts & Flavorings Spices & Pantry Fruit Add-Ins & Jams Mixes Cake &amp; Pie Shop Mixes Cake &amp; Pie Gluten-Free Chocolate Cake Mix #307505"
Gluten-Free Confetti Cake Mix,https://shop.kingarthurbaking.com/items/gluten-free-confetti-cake-mix,8.95,USD,"Pure fun! This tender cake, speckled with naturally colored sprinkles, is the perfect way to add some fun to your next celebration (or any happy occasion)! Made with no synthetic flavors, colors, or preservatives, our premium mix makes it easy to whip up this birthday classic in your own kitchen. It's a mix the kids will love to help with, too! Our mixes are carefully crafted in our test kitchen through meticulous taste-testing (it’s a tough job, but we’re up to the challenge!) and blending to replicate our favorite recipes. The result? Mixes that make the finest gluten-free baked goods around. Simple ingredients, reliable results, and deliciousness that everyone can enjoy! Click here to learn more about allergens and cross-contact prevention »",Ingredients Ingredients Ingredients Extracts & Flavorings Spices & Pantry Fruit Add-Ins & Jams,,4.8,251,https://cdn11.bigcommerce.com/s-ihwnd7z21q/images/stencil/1280x1280/products/797/2350/gluten-free-confetti-cake-mix-18-oz-1__45114.1724079444.jpg?c=1,,InStock,Cake &amp; Pie,Cake &amp; Pie,"['Shop', 'Mixes', 'Cake &amp; Pie', 'Gluten-Free Confetti Cake Mix #211331']","['cake', 'gluten-free', 'kit']","Gluten-Free Confetti Cake Mix Pure fun! This tender cake, speckled with naturally colored sprinkles, is the perfect way to add some fun to your next celebration (or any happy occasion)! Made with no synthetic flavors, colors, or preservatives, our premium mix makes it easy to whip up this birthday classic in your own kitchen. It's a mix the kids will love to help with, too! Our mixes are carefully crafted in our test kitchen through meticulous taste-testing (it’s a tough job, but we’re up to the challenge!) and blending to replicate our favorite recipes. The result? Mixes that make the finest gluten-free baked goods around. Simple ingredients, reliable results, and deliciousness that everyone can enjoy! Click here to learn more about allergens and cross-contact prevention » Ingredients Ingredients Ingredients Extracts & Flavorings Spices & Pantry Fruit Add-Ins & Jams Mixes Cake &amp; Pie Shop Mixes Cake &amp; Pie Gluten-Free Confetti Cake Mix #211331"
Gluten-Free Cookie Mix,https://shop.kingarthurbaking.com/items/gluten-free-cookie-mix,8.95,USD,"Simple pleasures await you in the form of Gluten-Free Chocolate Chip Cookies. The King Arthur Gluten-Free Cookie Mix was created so that everyone can enjoy their favorite cookies, in whatever flavor or variety you love. Our base mix recipe makes a buttery brown sugar cookie, then you can stir in your add-ins to customize: chocolate chips, raisins, dried fruit, and nuts. Make them differently every time if you like, but we promise they'll always taste delicious! Our mixes are carefully crafted in our test kitchen through meticulous taste-testing (it's a tough job, but we're up to the challenge!) and blending to replicate our favorite recipes.The result? Mixes that make the finest gluten-free baked goods around. Simple ingredients, reliable results, and deliciousness that everyone can enjoy! Click here to learn more about allergens and cross-contact prevention.",Ingredients Ingredients Ingredients Extracts & Flavorings Spices & Pantry Fruit Add-Ins & Jams,,4.9,219,https://cdn11.bigcommerce.com/s-ihwnd7z21q/images/stencil/1280x1280/products/1280/4935/07504G205G_211422_GFCookie_0221-3qtr__54376__22534.1724079465.jpg?c=1,,InStock,Cookies,Cookies,"['Shop', 'Mixes', 'Cookies', 'Gluten-Free Cookie Mix #307504']","['chocolate', 'cookie', 'gluten-free', 'kit']","Gluten-Free Cookie Mix Simple pleasures await you in the form of Gluten-Free Chocolate Chip Cookies. The King Arthur Gluten-Free Cookie Mix was created so that everyone can enjoy their favorite cookies, in whatever flavor or variety you love. Our base mix recipe makes a buttery brown sugar cookie, then you can stir in your add-ins to customize: chocolate chips, raisins, dried fruit, and nuts. Make them differently every time if you like, but we promise they'll always taste delicious! Our mixes are carefully crafted in our test kitchen through meticulous taste-testing (it's a tough job, but we're up to the challenge!) and blending to replicate our favorite recipes.The result? Mixes that make the finest gluten-free baked goods around. Simple ingredients, reliable results, and deliciousness that everyone can enjoy! Click here to learn more about allergens and cross-contact prevention. Ingredients Ingredients Ingredients Extracts & Flavorings Spices & Pantry Fruit Add-Ins & Jams Mixes Cookies Shop Mixes Cookies Gluten-Free Cookie Mix #307504"
Gluten-Free Cornbread and Muffin Mix,https://shop.kingarthurbaking.com/items/gluten-free-cornbread-and-muffin-mix,7.95,USD,"Finally, Gluten-Free Cornbread! This golden, tender cornbread is easy to prepare with our Gluten-Free Cornbread Mix (we've measured and mixed the same great ingredients you love for you!), loaded with whole grains (that means good and good for you), and is difficult to resist (trust us, we've tried). The mix, made with whole sorghum flour, makes a slightly sweet cornbread with a moist texture. Perfect alongside soup and stews or with a salad. Our mixes are carefully crafted in our test kitchen through meticulous taste-testing (it's a tough job, but we're up to the challenge!) and blending to replicate our favorite recipes. The result? Mixes that make the finest gluten-free baked goods around. Simple ingredients, reliable results, and deliciousness that everyone can enjoy! Click&nbsp;here&nbsp;to learn more about allergens and cross-contact prevention",Ingredients Ingredients Ingredients Extracts & Flavorings Spices & Pantry Fruit Add-Ins & Jams,,4.8,564,https://cdn11.bigcommerce.com/s-ihwnd7z21q/images/stencil/1280x1280/products/620/8729/200719G202G_211428_GFCornbreadMuffin_0221-3qtr__15519_3078__39188__46119.1740154756.jpg?c=1,,InStock,Muffins &amp; Quick Bread,Muffins &amp; Quick Bread,"['Shop', 'Mixes', 'Muffins &amp; Quick Bread', 'Gluten-Free Cornbread and Muffin Mix #200719']","['bread', 'gluten-free', 'kit', 'muffin']","Gluten-Free Cornbread and Muffin Mix Finally, Gluten-Free Cornbread! This golden, tender cornbread is easy to prepare with our Gluten-Free Cornbread Mix (we've measured and mixed the same great ingredients you love for you!), loaded with whole grains (that means good and good for you), and is difficult to resist (trust us, we've tried). The mix, made with whole sorghum flour, makes a slightly sweet cornbread with a moist texture. Perfect alongside soup and stews or with a salad. Our mixes are carefully crafted in our test kitchen through meticulous taste-testing (it's a tough job, but we're up to the challenge!) and blending to replicate our favorite recipes. The result? Mixes that make the finest gluten-free baked goods around. Simple ingredients, reliable results, and deliciousness that everyone can enjoy! Click&nbsp;here&nbsp;to learn more about allergens and cross-contact prevention Ingredients Ingredients Ingredients Extracts & Flavorings Spices & Pantry Fruit Add-Ins & Jams Mixes Muffins &amp; Quick Bread Shop Mixes Muffins &amp; Quick Bread Gluten-Free Cornbread and Muffin Mix #200719"
Gluten-Free Doughnut Mix,https://shop.kingarthurbaking.com/items/gluten-free-doughnut-mix,8.95,USD,"Fresh, hot doughnuts are the ultimate treat. Our mix gives you a helping hand and turns out perfect batches of gluten-free doughnuts every time. Baked, not fried, so you can enjoy this classic gluten-free and guilt-free. Just mix together the butter, oil, milk, and eggs into the mix, fill the wells of your doughnut pan, bake, and enjoy. Our mixes are carefully crafted in our test kitchen through meticulous taste-testing (it's a tough job, but we're up to the challenge!) and blending to replicate our favorite recipes. The result? Mixes that make the finest gluten-free baked goods around. Simple ingredients, reliable results, and deliciousness for everyone to enjoy! You'll need a doughnut pan to bake this mix. Click&nbsp;here&nbsp;to learn more about allergens and cross-contact prevention",Ingredients Ingredients Ingredients Extracts & Flavorings Spices & Pantry Fruit Add-Ins & Jams,,4.8,599,https://cdn11.bigcommerce.com/s-ihwnd7z21q/images/stencil/1280x1280/products/1279/4998/40390G201J_211430_GFDoughnut_0221-3qtr__68812__46984.1724079464.jpg?c=1,,InStock,Doughnuts,Doughnuts,"['Shop', 'Mixes', 'Doughnuts', 'Gluten-Free Doughnut Mix #340390']","['gluten-free', 'kit']","Gluten-Free Doughnut Mix Fresh, hot doughnuts are the ultimate treat. Our mix gives you a helping hand and turns out perfect batches of gluten-free doughnuts every time. Baked, not fried, so you can enjoy this classic gluten-free and guilt-free. Just mix together the butter, oil, milk, and eggs into the mix, fill the wells of your doughnut pan, bake, and enjoy. Our mixes are carefully crafted in our test kitchen through meticulous taste-testing (it's a tough job, but we're up to the challenge!) and blending to replicate our favorite recipes. The result? Mixes that make the finest gluten-free baked goods around. Simple ingredients, reliable results, and deliciousness for everyone to enjoy! You'll need a doughnut pan to bake this mix. Click&nbsp;here&nbsp;to learn more about allergens and cross-contact prevention Ingredients Ingredients Ingredients Extracts & Flavorings Spices & Pantry Fruit Add-Ins & Jams Mixes Doughnuts Shop Mixes Doughnuts Gluten-Free Doughnut Mix #340390"
Gluten-Free Fudge Brownie Mix,https://shop.kingarthurbaking.com/items/gluten-free-fudge-brownie-mix,8.95,USD,"Fudgy, rich, gluten-free brownies are easy to make with this handy mix. With a smooth texture and deep chocolate flavor, it's a favorite among brownie lovers. Keep it in your pantry so you're never far from a delicious dessert! Just stir in 2 eggs, melted butter or vegetable oil, and water. Spoon into your pan, bake, and enjoy. Our mixes are carefully crafted in our test kitchen through meticulous taste-testing (it's a tough job, but we're up to the challenge!) and blending to replicate our favorite recipes. The result? Mixes that make the finest gluten-free baked goods around. Simple ingredients, reliable results, and deliciousness that everyone can enjoy! Read the blog: I’m not gluten-free — but my favorite brownie mix is Click here to learn more about allergens and cross-contact prevention",Ingredients Ingredients Ingredients Extracts & Flavorings Spices & Pantry Fruit Add-Ins & Jams,,4.9,280,https://cdn11.bigcommerce.com/s-ihwnd7z21q/images/stencil/1280x1280/products/1267/4941/07508G205G_211415_GlutenFreeUltimateFudgeBrownie_3qtr__20977__45767.1724079468.jpg?c=1,,InStock,Cookies,Cookies,"['Shop', 'Mixes', 'Cookies', 'Gluten-Free Fudge Brownie Mix #307508']","['brownie', 'chocolate', 'cookie', 'gluten-free', 'kit']","Gluten-Free Fudge Brownie Mix Fudgy, rich, gluten-free brownies are easy to make with this handy mix. With a smooth texture and deep chocolate flavor, it's a favorite among brownie lovers. Keep it in your pantry so you're never far from a delicious dessert! Just stir in 2 eggs, melted butter or vegetable oil, and water. Spoon into your pan, bake, and enjoy. Our mixes are carefully crafted in our test kitchen through meticulous taste-testing (it's a tough job, but we're up to the challenge!) and blending to replicate our favorite recipes. The result? Mixes that make the finest gluten-free baked goods around. Simple ingredients, reliable results, and deliciousness that everyone can enjoy! Read the blog: I’m not gluten-free — but my favorite brownie mix is Click here to learn more about allergens and cross-contact prevention Ingredients Ingredients Ingredients Extracts & Flavorings Spices & Pantry Fruit Add-Ins & Jams Mixes Cookies Shop Mixes Cookies Gluten-Free Fudge Brownie Mix #307508"
