name,url,price,currency,description,ingredients,size,rating,review_count,image_url,brand,availability,category,subcategory,breadcrumbs,tags,search_text
Keto Wheat Pancake Mix,https://shop.kingarthurbaking.com/items/Keto-Wheat-Pancake-Mix,6.95,USD,"Low in carbs, high in flavor! With just 2g of net carbs, our quick and simple mix makes it easy to keep your carbs low and your mornings delicious! These keto-friendly pancakes boast 9g of protein and 12g of fiber. Simply add water, and you’re well on your way to stacks of tender, fluffy pancakes perfect for breakfast or even dinner. A convenient, resealable, and recyclable pouch makes it easy to portion just the right amount or save some for next time.",Ingredients Ingredients Ingredients Extracts & Flavorings Spices & Pantry Fruit Add-Ins & Jams,,4.5,205,https://cdn11.bigcommerce.com/s-ihwnd7z21q/images/stencil/1280x1280/products/1053/4024/212259_front__65354.1724079465.jpg?c=1,,InStock,Pancakes,Pancakes,"['Shop', 'Mixes', 'Pancakes', 'Keto Wheat Pancake Mix #212259']","['cake', 'pancake']","Keto Wheat Pancake Mix Low in carbs, high in flavor! With just 2g of net carbs, our quick and simple mix makes it easy to keep your carbs low and your mornings delicious! These keto-friendly pancakes boast 9g of protein and 12g of fiber. Simply add water, and you’re well on your way to stacks of tender, fluffy pancakes perfect for breakfast or even dinner. A convenient, resealable, and recyclable pouch makes it easy to portion just the right amount or save some for next time. Ingredients Ingredients Ingredients Extracts & Flavorings Spices & Pantry Fruit Add-Ins & Jams Mixes Pancakes Shop Mixes Pancakes Keto Wheat Pancake Mix #212259"
Alaskan Sourdough Yeast Bread Mix,https://shop.kingarthurbaking.com/items/alaskan-sourdough-yeast-bread-mix,7.95,USD,"You'll be serving fresh bread from the oven in no time. Turn out a warm loaf of traditional sourdough bread with a chewy texture, a mild sourdough flavor, and a crunchy crust. Shape into a rustic boule, bake in a traditional loaf pan, or divide and make into dinner rolls. Can be made in a bread machine, using the basic dough cycle. Add the ingredients in the order that your bread machine instructions advise. Homemade bread is one of life's greatest pleasures, and our mixes help you bake it easily at home. Made with only the simple, good, non-GMO ingredients you want and nothing you don't: no artificial sweeteners or flavors, no artificial colors, and no high-fructose corn syrup. Video: How to knead bread dough Video: How to tell if bread dough is fully kneaded",Ingredients Ingredients Ingredients Extracts & Flavorings Spices & Pantry Fruit Add-Ins & Jams,½-lb,4.3,661,https://cdn11.bigcommerce.com/s-ihwnd7z21q/images/stencil/1280x1280/products/577/7321/100287__79359_3156__50405.1724079441.jpg?c=1,,OutOfStock,Bread,Bread,"['Shop', 'Mixes', 'Bread', 'Alaskan Sourdough Yeast Bread Mix #100287']",['bread'],"Alaskan Sourdough Yeast Bread Mix You'll be serving fresh bread from the oven in no time. Turn out a warm loaf of traditional sourdough bread with a chewy texture, a mild sourdough flavor, and a crunchy crust. Shape into a rustic boule, bake in a traditional loaf pan, or divide and make into dinner rolls. Can be made in a bread machine, using the basic dough cycle. Add the ingredients in the order that your bread machine instructions advise. Homemade bread is one of life's greatest pleasures, and our mixes help you bake it easily at home. Made with only the simple, good, non-GMO ingredients you want and nothing you don't: no artificial sweeteners or flavors, no artificial colors, and no high-fructose corn syrup. Video: How to knead bread dough Video: How to tell if bread dough is fully kneaded Ingredients Ingredients Ingredients Extracts & Flavorings Spices & Pantry Fruit Add-Ins & Jams Mixes Bread Shop Mixes Bread Alaskan Sourdough Yeast Bread Mix #100287"
All-American Fudge Brownie Mix,https://shop.kingarthurbaking.com/items/all-american-fudge-brownie-mix,8.95,USD,"Deep, dark, rich brownies are just a few steps away with our easy mix. Our premium brownie mix is made with unbleached King Arthur Flour and a blend of flavorful cocoas. Just add eggs, butter or vegetable oil, and water, and you're well on your way to delicious, chocolatey, homemade brownies! Our mixes are carefully crafted in our test kitchen through meticulous taste-testing (it's a tough job, but we're up to the challenge!) and blending to replicate our favorite recipes. The best part? We do the measuring and mixing for you. The result? Consistent deliciousness that everyone can enjoy made with simple ingredients that we bake with every day in our kitchens — no artificial colors or flavors, no preservatives, and all non-GMO. Perfect Pairing: Cyprus Flake Sea Salt - Elevate your brownies with a touch of flaky sea salt. High Altitude Baking: Keep oven temperature at 325°F. Use a 9-inch square pan if adding nuts or chips to the recipe. 6 tablespoons melted butter yields better results...",Ingredients Ingredients Ingredients Extracts & Flavorings Spices & Pantry Fruit Add-Ins & Jams,,4.8,716,https://cdn11.bigcommerce.com/s-ihwnd7z21q/images/stencil/1280x1280/products/570/7292/100254_front__90963_3308__98702.1724079451.jpg?c=1,,OutOfStock,Cookies,Cookies,"['Shop', 'Mixes', 'Cookies', 'All-American Fudge Brownie Mix #100254']","['brownie', 'chocolate', 'cookie', 'kit']","All-American Fudge Brownie Mix Deep, dark, rich brownies are just a few steps away with our easy mix. Our premium brownie mix is made with unbleached King Arthur Flour and a blend of flavorful cocoas. Just add eggs, butter or vegetable oil, and water, and you're well on your way to delicious, chocolatey, homemade brownies! Our mixes are carefully crafted in our test kitchen through meticulous taste-testing (it's a tough job, but we're up to the challenge!) and blending to replicate our favorite recipes. The best part? We do the measuring and mixing for you. The result? Consistent deliciousness that everyone can enjoy made with simple ingredients that we bake with every day in our kitchens — no artificial colors or flavors, no preservatives, and all non-GMO. Perfect Pairing: Cyprus Flake Sea Salt - Elevate your brownies with a touch of flaky sea salt. High Altitude Baking: Keep oven temperature at 325°F. Use a 9-inch square pan if adding nuts or chips to the recipe. 6 tablespoons melted butter yields better results... Ingredients Ingredients Ingredients Extracts & Flavorings Spices & Pantry Fruit Add-Ins & Jams Mixes Cookies Shop Mixes Cookies All-American Fudge Brownie Mix #100254"
All-Purpose Baking Mix,https://shop.kingarthurbaking.com/items/all-purpose-baking-mix,6.95,USD,"All-Purpose Baking Mix: simple ingredients, endless possibilities. With just four ingredients — flour, baking powder, sugar, and salt — our All-Purpose Baking Mix keeps things simple, so you can focus on the fun part: baking! This custom blend lets you create everything from fluffy pancakes and waffles to flaky biscuits, with extra options like banana bread, chocolate cake, sugar cookies, and doughnut holes (check out this recipe collection!). It's also a great choice for vegan and dairy-free recipes. With 6 grams of prebiotic fiber per serving to support gut health and a resealable pouch for easy storage, it’s the simple solution for delicious, convenient baking. &nbsp;",Ingredients Ingredients Ingredients Extracts & Flavorings Spices & Pantry Fruit Add-Ins & Jams,16 oz,4.5,21,https://cdn11.bigcommerce.com/s-ihwnd7z21q/images/stencil/1280x1280/products/1655/8607/213797_front__82285.1735846612.jpg?c=1,,InStock,Muffins &amp; Quick Bread,Muffins &amp; Quick Bread,"['Shop', 'Mixes', 'Muffins &amp; Quick Bread', 'All-Purpose Baking Mix #213797']","['biscuit', 'bread', 'cake', 'chocolate', 'cookie', 'muffin', 'pancake', 'waffle']","All-Purpose Baking Mix All-Purpose Baking Mix: simple ingredients, endless possibilities. With just four ingredients — flour, baking powder, sugar, and salt — our All-Purpose Baking Mix keeps things simple, so you can focus on the fun part: baking! This custom blend lets you create everything from fluffy pancakes and waffles to flaky biscuits, with extra options like banana bread, chocolate cake, sugar cookies, and doughnut holes (check out this recipe collection!). It's also a great choice for vegan and dairy-free recipes. With 6 grams of prebiotic fiber per serving to support gut health and a resealable pouch for easy storage, it’s the simple solution for delicious, convenient baking. &nbsp; Ingredients Ingredients Ingredients Extracts & Flavorings Spices & Pantry Fruit Add-Ins & Jams Mixes Muffins &amp; Quick Bread Shop Mixes Muffins &amp; Quick Bread All-Purpose Baking Mix #213797"
Almond-Filled Sweet Bread Mix,https://shop.kingarthurbaking.com/items/almond-filled-sweet-bread-mix,18.95,USD,"The ultimate sweet bread for almond fans! Swirled with a toasted almond filling, this sweet bread is a buttery treat that is easy to make and shape with the help of our mix. To elevate to a heavenly level, top with Almond Glaze for an extra touch of almondy sweetness and picturesque finishing touch. Serve as a tasty centerpiece on any brunch or dessert table.Homemade bread is one of life's greatest pleasures, and our mixes help you bake it easily at home. Made with only the simple, good, non-GMO ingredients you want and nothing you don't: no artificial sweeteners or flavors, no artificial colors, and no high-fructose corn syrup. You'll be serving fresh bread from the oven in no time. Video: How to knead bread dough Video: How to tell if bread dough is fully kneaded",Ingredients Ingredients Ingredients Extracts & Flavorings Spices & Pantry Fruit Add-Ins & Jams,,4.6,421,https://cdn11.bigcommerce.com/s-ihwnd7z21q/images/stencil/1280x1280/products/862/2782/100199__85174.1724079457.jpg?c=1,,InStock,Bread,Bread,"['Shop', 'Mixes', 'Bread', 'Almond-Filled Sweet Bread Mix #100199']",['bread'],"Almond-Filled Sweet Bread Mix The ultimate sweet bread for almond fans! Swirled with a toasted almond filling, this sweet bread is a buttery treat that is easy to make and shape with the help of our mix. To elevate to a heavenly level, top with Almond Glaze for an extra touch of almondy sweetness and picturesque finishing touch. Serve as a tasty centerpiece on any brunch or dessert table.Homemade bread is one of life's greatest pleasures, and our mixes help you bake it easily at home. Made with only the simple, good, non-GMO ingredients you want and nothing you don't: no artificial sweeteners or flavors, no artificial colors, and no high-fructose corn syrup. You'll be serving fresh bread from the oven in no time. Video: How to knead bread dough Video: How to tell if bread dough is fully kneaded Ingredients Ingredients Ingredients Extracts & Flavorings Spices & Pantry Fruit Add-Ins & Jams Mixes Bread Shop Mixes Bread Almond-Filled Sweet Bread Mix #100199"
Apple Cinnamon Doughnut Mix,https://shop.kingarthurbaking.com/items/apple-cinnamon-doughnut-mix,8.95,USD,"Cinnamon doughnuts studded with dried apple bits. Find out just how delicious a baked doughnut can be! Drizzle these Apple Cinnamon Doughnuts with your own melted caramel for an over-the-top treat. Our mixes are carefully crafted in our test kitchen through meticulous taste-testing (it's a tough job, but we're up to the challenge!) and blending to replicate our favorite recipes. The best part? We do the measuring and mixing for you. The result? Consistent deliciousness that everyone can enjoy made with simple ingredients that we bake with every day in our kitchens — no artificial colors or flavors, no preservatives, and all non-GMO.",Ingredients Ingredients Ingredients Extracts & Flavorings Spices & Pantry Fruit Add-Ins & Jams,16 oz,4.3,416,https://cdn11.bigcommerce.com/s-ihwnd7z21q/images/stencil/1280x1280/products/571/7297/100260_front__82578_3314__70782.1763059341.jpg?c=1,,OutOfStock,Doughnuts &amp; Muffins,Doughnuts &amp; Muffins,"['Shop', 'Mixes', 'Doughnuts &amp; Muffins', 'Apple Cinnamon Doughnut Mix #100260']","['cinnamon', 'kit', 'muffin']","Apple Cinnamon Doughnut Mix Cinnamon doughnuts studded with dried apple bits. Find out just how delicious a baked doughnut can be! Drizzle these Apple Cinnamon Doughnuts with your own melted caramel for an over-the-top treat. Our mixes are carefully crafted in our test kitchen through meticulous taste-testing (it's a tough job, but we're up to the challenge!) and blending to replicate our favorite recipes. The best part? We do the measuring and mixing for you. The result? Consistent deliciousness that everyone can enjoy made with simple ingredients that we bake with every day in our kitchens — no artificial colors or flavors, no preservatives, and all non-GMO. Ingredients Ingredients Ingredients Extracts & Flavorings Spices & Pantry Fruit Add-Ins & Jams Mixes Doughnuts &amp; Muffins Shop Mixes Doughnuts &amp; Muffins Apple Cinnamon Doughnut Mix #100260"
Apple Cinnamon Scone Mix,https://shop.kingarthurbaking.com/items/apple-cinnamon-scone-mix,8.95,USD,"Enjoy sweet fall flavors in your kitchen all year long with apple cinnamon scones. Made with the finest Vietnamese cinnamon, real apples, and apple cinnamon jammy bits, our simple mix bakes up light, tall, and fluffy. Freshly baked homemade scones are quick and easy with our simple scone mixes. Perfect for serving at breakfast, an afternoon snack, for yourself, your family, or your guests. Simply blend, shape, and bake for warm, delicious scones in fewer than 30 minutes.",Ingredients Ingredients Ingredients Extracts & Flavorings Spices & Pantry Fruit Add-Ins & Jams,,4.7,653,https://cdn11.bigcommerce.com/s-ihwnd7z21q/images/stencil/1280x1280/products/542/7146/100202__54910_3140__06815.1724079439.jpg?c=1,,OutOfStock,Scones,Scones,"['Shop', 'Mixes', 'Scones', 'Apple Cinnamon Scone Mix #100202']","['cinnamon', 'kit', 'scone']","Apple Cinnamon Scone Mix Enjoy sweet fall flavors in your kitchen all year long with apple cinnamon scones. Made with the finest Vietnamese cinnamon, real apples, and apple cinnamon jammy bits, our simple mix bakes up light, tall, and fluffy. Freshly baked homemade scones are quick and easy with our simple scone mixes. Perfect for serving at breakfast, an afternoon snack, for yourself, your family, or your guests. Simply blend, shape, and bake for warm, delicious scones in fewer than 30 minutes. Ingredients Ingredients Ingredients Extracts & Flavorings Spices & Pantry Fruit Add-Ins & Jams Mixes Scones Shop Mixes Scones Apple Cinnamon Scone Mix #100202"
Apple-Cinnamon Whole Grain Muffin and Quick Bread Mix,https://shop.kingarthurbaking.com/items/apple-cinnamon-whole-grain-muffin-and-quick-bread-mix,8.95,USD,"Apple Cinnamon Muffins made with buttermilk for an even more tender crumb and delectable flavor. Fragrant with spicy cinnamon and studded with dried apple bits, these tender and light muffins taste just like fall-—and you can enjoy the seasonal flavor all year long! Our mixes are carefully crafted in our test kitchen through meticulous taste-testing (it's a tough job, but we're up to the challenge!) and blending to replicate our favorite recipes. The best part? We do the measuring and mixing for you. The result? Consistent deliciousness that everyone can enjoy made with simple ingredients that we bake with every day in our kitchens — no artificial colors or flavors, no preservatives, and all non-GMO.",Ingredients Ingredients Ingredients Extracts & Flavorings Spices & Pantry Fruit Add-Ins & Jams,,4.3,448,https://cdn11.bigcommerce.com/s-ihwnd7z21q/images/stencil/1280x1280/products/581/7340/100302_front__61148_3325__19100.1724079445.jpg?c=1,,OutOfStock,Doughnuts &amp; Muffins,Doughnuts &amp; Muffins,"['Shop', 'Mixes', 'Doughnuts &amp; Muffins', 'Apple-Cinnamon Whole Grain Muffin and Quick Bread Mix #100302']","['bread', 'cinnamon', 'kit', 'muffin']","Apple-Cinnamon Whole Grain Muffin and Quick Bread Mix Apple Cinnamon Muffins made with buttermilk for an even more tender crumb and delectable flavor. Fragrant with spicy cinnamon and studded with dried apple bits, these tender and light muffins taste just like fall-—and you can enjoy the seasonal flavor all year long! Our mixes are carefully crafted in our test kitchen through meticulous taste-testing (it's a tough job, but we're up to the challenge!) and blending to replicate our favorite recipes. The best part? We do the measuring and mixing for you. The result? Consistent deliciousness that everyone can enjoy made with simple ingredients that we bake with every day in our kitchens — no artificial colors or flavors, no preservatives, and all non-GMO. Ingredients Ingredients Ingredients Extracts & Flavorings Spices & Pantry Fruit Add-Ins & Jams Mixes Doughnuts &amp; Muffins Shop Mixes Doughnuts &amp; Muffins Apple-Cinnamon Whole Grain Muffin and Quick Bread Mix #100302"
Apricot Sour Cream Scone Mix,https://shop.kingarthurbaking.com/items/apricot-sour-cream-scone-mix,8.95,USD,"The perfect balance of tangy sour cream and sweet apricot in a tender, buttery scone. With our our easy-to-make mix, you can experience bursts of bright fruity flavor in each bite thanks to our soft and chewy Apricot Jammy Bits, made with real apricots. Freshly baked homemade scones are quick and easy with our simple scone mixes. Perfect for serving at breakfast, an afternoon snack, for yourself, your family, or your guests. Simply blend, shape, and bake for warm, delicious scones in fewer than 30 minutes.",Ingredients Ingredients Ingredients Extracts & Flavorings Spices & Pantry Fruit Add-Ins & Jams,,4.8,691,https://cdn11.bigcommerce.com/s-ihwnd7z21q/images/stencil/1280x1280/products/543/7151/100203_packagefront__67127_3301__30640.1724079440.jpg?c=1,,OutOfStock,Scones,Scones,"['Shop', 'Mixes', 'Scones', 'Apricot Sour Cream Scone Mix #100203']",['scone'],"Apricot Sour Cream Scone Mix The perfect balance of tangy sour cream and sweet apricot in a tender, buttery scone. With our our easy-to-make mix, you can experience bursts of bright fruity flavor in each bite thanks to our soft and chewy Apricot Jammy Bits, made with real apricots. Freshly baked homemade scones are quick and easy with our simple scone mixes. Perfect for serving at breakfast, an afternoon snack, for yourself, your family, or your guests. Simply blend, shape, and bake for warm, delicious scones in fewer than 30 minutes. Ingredients Ingredients Ingredients Extracts & Flavorings Spices & Pantry Fruit Add-Ins & Jams Mixes Scones Shop Mixes Scones Apricot Sour Cream Scone Mix #100203"
Banana Bread Mix,https://shop.kingarthurbaking.com/items/banana-bread-mix,7.95,USD,"Simple, classic banana bread in no time. Enjoy a cozy loaf of banana bread in under an hour — just add water, oil, and eggs. Real bananas and a hint of cinnamon create a tender, perfectly sweet quick bread that’s delicious on its own or easy to customize with chocolate chips, nuts, or any favorite additions. Bake it as a loaf or turn it into muffins — it’s a reliable, comforting treat for breakfast, with coffee, or anytime you want something warm and homemade. &nbsp;",Ingredients Ingredients Ingredients Extracts & Flavorings Spices & Pantry Fruit Add-Ins & Jams,,,,https://cdn11.bigcommerce.com/s-ihwnd7z21q/images/stencil/1280x1280/products/1939/9741/400392_Banana_Bread__44392.1771860667.jpg?c=1,,InStock,Muffins &amp; Quick Bread,Muffins &amp; Quick Bread,"['Shop', 'Mixes', 'Muffins &amp; Quick Bread', 'Banana Bread Mix #400392']","['bread', 'chocolate', 'cinnamon', 'muffin']","Banana Bread Mix Simple, classic banana bread in no time. Enjoy a cozy loaf of banana bread in under an hour — just add water, oil, and eggs. Real bananas and a hint of cinnamon create a tender, perfectly sweet quick bread that’s delicious on its own or easy to customize with chocolate chips, nuts, or any favorite additions. Bake it as a loaf or turn it into muffins — it’s a reliable, comforting treat for breakfast, with coffee, or anytime you want something warm and homemade. &nbsp; Ingredients Ingredients Ingredients Extracts & Flavorings Spices & Pantry Fruit Add-Ins & Jams Mixes Muffins &amp; Quick Bread Shop Mixes Muffins &amp; Quick Bread Banana Bread Mix #400392"
Belgian Waffle Mix,https://shop.kingarthurbaking.com/items/belgian-waffle-mix,7.95,USD,"Restaurant-style, deep-pocketed waffles. With corn flour for color and texture and a hint of maple and malt, this European-style yeasted waffle mix makes incredible waffles that are crisp and golden on the outside while being light and fluffy on the inside! Serve with whipped cream and strawberries, as we do here in America, or serve as they do in Belgium: dusted with confectioners' sugar or topped with whipped cream or chocolate spread. They may also be enjoyed with ice cream, for dessert. Our mixes are carefully crafted in our test kitchen through meticulous taste-testing (it's a tough job, but we're up to the challenge!) and blending to replicate our favorite recipes. The best part? We do the measuring and mixing for you. The result? Consistent deliciousness that everyone can enjoy made with simple ingredients that we bake with every day in our kitchens — no artificial colors or flavors, no preservatives, and all non-GMO.",Ingredients Ingredients Ingredients Extracts & Flavorings Spices & Pantry Fruit Add-Ins & Jams,,4.7,488,https://cdn11.bigcommerce.com/s-ihwnd7z21q/images/stencil/1280x1280/products/863/3335/100177_front__19423.1724079458.jpg?c=1,,OutOfStock,Pancakes,Pancakes,"['Shop', 'Mixes', 'Pancakes', 'Belgian Waffle Mix #100177']","['cake', 'chocolate', 'kit', 'pancake', 'waffle']","Belgian Waffle Mix Restaurant-style, deep-pocketed waffles. With corn flour for color and texture and a hint of maple and malt, this European-style yeasted waffle mix makes incredible waffles that are crisp and golden on the outside while being light and fluffy on the inside! Serve with whipped cream and strawberries, as we do here in America, or serve as they do in Belgium: dusted with confectioners' sugar or topped with whipped cream or chocolate spread. They may also be enjoyed with ice cream, for dessert. Our mixes are carefully crafted in our test kitchen through meticulous taste-testing (it's a tough job, but we're up to the challenge!) and blending to replicate our favorite recipes. The best part? We do the measuring and mixing for you. The result? Consistent deliciousness that everyone can enjoy made with simple ingredients that we bake with every day in our kitchens — no artificial colors or flavors, no preservatives, and all non-GMO. Ingredients Ingredients Ingredients Extracts & Flavorings Spices & Pantry Fruit Add-Ins & Jams Mixes Pancakes Shop Mixes Pancakes Belgian Waffle Mix #100177"
Blueberry Sour Cream Scone Mix,https://shop.kingarthurbaking.com/items/blueberry-sour-cream-scone-mix,8.95,USD,"Start your morning with blueberry scones! Tart blueberries blend perfectly with tangy sour cream — perfect alongside a hot cup of coffee or tea. Freshly baked homemade scones are quick and easy with our simple scone mixes. Perfect for serving at breakfast, an afternoon snack, for yourself, your family, or your guests. Simply blend, shape, and bake for warm, delicious scones in fewer than 30 minutes.",Ingredients Ingredients Ingredients Extracts & Flavorings Spices & Pantry Fruit Add-Ins & Jams,,4.8,736,https://cdn11.bigcommerce.com/s-ihwnd7z21q/images/stencil/1280x1280/products/544/7155/100204_front__92456_3562__81270.1724079441.jpg?c=1,,OutOfStock,Scones,Scones,"['Shop', 'Mixes', 'Scones', 'Blueberry Sour Cream Scone Mix #100204']",['scone'],"Blueberry Sour Cream Scone Mix Start your morning with blueberry scones! Tart blueberries blend perfectly with tangy sour cream — perfect alongside a hot cup of coffee or tea. Freshly baked homemade scones are quick and easy with our simple scone mixes. Perfect for serving at breakfast, an afternoon snack, for yourself, your family, or your guests. Simply blend, shape, and bake for warm, delicious scones in fewer than 30 minutes. Ingredients Ingredients Ingredients Extracts & Flavorings Spices & Pantry Fruit Add-Ins & Jams Mixes Scones Shop Mixes Scones Blueberry Sour Cream Scone Mix #100204"
Broccoli Cheddar Soup,https://shop.kingarthurbaking.com/items/broccoli-cheddar-soup,9.95,USD,"Savor the rich, nourishing taste of homemade soup, made easy using our premium mix. If we're not cooking from scratch, we're mixing up delicious soups from Frontier's convenient mixes. Made with the finest natural ingredients, no added salt, no preservatives or MSG, you can taste the difference — our families and friends always ask for the recipe! Comforting, thick, cheesy broccoli cheddar soup is a classic. Simply add broth and cream for a warm, just-cooked dinner on the table.",Ingredients Ingredients Ingredients Extracts & Flavorings Spices & Pantry Fruit Add-Ins & Jams,,4.4,152,https://cdn11.bigcommerce.com/s-ihwnd7z21q/images/stencil/1280x1280/products/253/6294/207159_broccoli_cheddar_soup__86861_4185__29652.1724079437.jpg?c=1,,InStock,Specialty,Specialty,"['Shop', 'Mixes', 'Specialty', 'Broccoli Cheddar Soup #207159']",[],"Broccoli Cheddar Soup Savor the rich, nourishing taste of homemade soup, made easy using our premium mix. If we're not cooking from scratch, we're mixing up delicious soups from Frontier's convenient mixes. Made with the finest natural ingredients, no added salt, no preservatives or MSG, you can taste the difference — our families and friends always ask for the recipe! Comforting, thick, cheesy broccoli cheddar soup is a classic. Simply add broth and cream for a warm, just-cooked dinner on the table. Ingredients Ingredients Ingredients Extracts & Flavorings Spices & Pantry Fruit Add-Ins & Jams Mixes Specialty Shop Mixes Specialty Broccoli Cheddar Soup #207159"
