name,url,price,currency,description,ingredients,size,rating,review_count,image_url,brand,availability,category,subcategory,breadcrumbs,tags,search_text
Chocolate Indulgence Cake Mix,https://shop.kingarthurbaking.com/items/chocolate-indulgence-cake-mix,16.95,USD,"The ultimate chocolate dessert! We call this the ""chocolate indulgence"" for good reason: it's exceptionally dark, dense, moist, and rich. Made with cocoa powder and two kinds of chocolate, our mix yields an impressive and elegant dessert. Mix includes bittersweet chocolate discs to make a satiny smooth glaze. Our mixes are carefully crafted in our test kitchen through meticulous taste-testing (it's a tough job, but we're up to the challenge!) and blending to replicate our favorite recipes. The best part? We do the measuring and mixing for you. The result? Consistent deliciousness that everyone can enjoy made with simple ingredients that we bake with every day in our kitchens — no artificial colors or flavors, no preservatives, and all non-GMO. &nbsp;",Ingredients Ingredients Ingredients Extracts & Flavorings Spices & Pantry Fruit Add-Ins & Jams,,4.8,485,https://cdn11.bigcommerce.com/s-ihwnd7z21q/images/stencil/1280x1280/products/564/7262/100234_front__79111_3293__53457.1724079446.jpg?c=1,,InStock,Cake &amp; Pie,Cake &amp; Pie,"['Shop', 'Mixes', 'Cake &amp; Pie', 'Chocolate Indulgence Cake Mix #100234']","['cake', 'chocolate', 'kit']","Chocolate Indulgence Cake Mix The ultimate chocolate dessert! We call this the ""chocolate indulgence"" for good reason: it's exceptionally dark, dense, moist, and rich. Made with cocoa powder and two kinds of chocolate, our mix yields an impressive and elegant dessert. Mix includes bittersweet chocolate discs to make a satiny smooth glaze. Our mixes are carefully crafted in our test kitchen through meticulous taste-testing (it's a tough job, but we're up to the challenge!) and blending to replicate our favorite recipes. The best part? We do the measuring and mixing for you. The result? Consistent deliciousness that everyone can enjoy made with simple ingredients that we bake with every day in our kitchens — no artificial colors or flavors, no preservatives, and all non-GMO. &nbsp; Ingredients Ingredients Ingredients Extracts & Flavorings Spices & Pantry Fruit Add-Ins & Jams Mixes Cake &amp; Pie Shop Mixes Cake &amp; Pie Chocolate Indulgence Cake Mix #100234"
Chocolate Indulgence Mix & Tree Mold,https://shop.kingarthurbaking.com/items/chocolate-indulgence-mix-tree-mold,54.06,USD,"Create a sweet holiday centerpiece with this set! Bake an adorable (and delicious) chocolate tree for the holidays with this festive set. It includes our flexible silicone Evergreen Tree Cake Mold, designed for perfectly shaped cakes every time, plus our Chocolate Indulgence Cake Mix — a rich, dark, and decadent cake topped with a silky ganache. Together, they make it easy to create a showstopping dessert for any festive gathering. Place mold on a sheet pan to make transport to and from the oven easier. Bake at 325°F for 52 minutes. Let cake cool to room temperature, place a serving dish on top of the mold, and flip to release the cake.",Ingredients Ingredients Ingredients Extracts & Flavorings Spices & Pantry Fruit Add-Ins & Jams,,,,https://cdn11.bigcommerce.com/s-ihwnd7z21q/images/stencil/1280x1280/products/1790/9122/400054_1__58231.1753971285.jpg?c=1,,InStock,Mix &amp; Pan Sets,Mix &amp; Pan Sets,"['Shop', 'Pans', 'Mix &amp; Pan Sets', 'Chocolate Indulgence Mix &amp; Tree Mold #400054']","['cake', 'chocolate']","Chocolate Indulgence Mix & Tree Mold Create a sweet holiday centerpiece with this set! Bake an adorable (and delicious) chocolate tree for the holidays with this festive set. It includes our flexible silicone Evergreen Tree Cake Mold, designed for perfectly shaped cakes every time, plus our Chocolate Indulgence Cake Mix — a rich, dark, and decadent cake topped with a silky ganache. Together, they make it easy to create a showstopping dessert for any festive gathering. Place mold on a sheet pan to make transport to and from the oven easier. Bake at 325°F for 52 minutes. Let cake cool to room temperature, place a serving dish on top of the mold, and flip to release the cake. Ingredients Ingredients Ingredients Extracts & Flavorings Spices & Pantry Fruit Add-Ins & Jams Pans Mix &amp; Pan Sets Shop Pans Mix &amp; Pan Sets Chocolate Indulgence Mix &amp; Tree Mold #400054"
Chocolate Lava Cake Mix,https://shop.kingarthurbaking.com/items/chocolate-lava-cake-mix,12.95,USD,"This rich, moist chocolate cake makes its own hot fudge sauce. Just cut it open and enjoy the molten treasure inside. Made with King Arthur Flour, sweet chocolate, dark cocoa, and pure premium vanilla. Hot fudge flows from the center of this cake. Ready in under 20 minutes! Just add water, butter, and eggs, bake, and enjoy! Bake in standard custard cups or silicone molds. Cakes may be refrigerated or frozen in silicone molds until ready to bake. Our mixes are carefully crafted in our test kitchen through meticulous taste-testing (it's a tough job, but we're up to the challenge!) and blending to replicate our favorite recipes. The best part? We do the measuring and mixing for you. The result? Consistent deliciousness that everyone can enjoy made with simple ingredients that we bake with every day in our kitchens — no artificial colors or flavors, no preservatives, and all non-GMO.",Ingredients Ingredients Ingredients Extracts & Flavorings Spices & Pantry Fruit Add-Ins & Jams,,4.9,477,https://cdn11.bigcommerce.com/s-ihwnd7z21q/images/stencil/1280x1280/products/575/7313/100274_front__21529_3281__12144.1724079439.jpg?c=1,,InStock,Cake &amp; Pie,Cake &amp; Pie,"['Shop', 'Mixes', 'Cake &amp; Pie', 'Chocolate Lava Cake Mix #100274']","['cake', 'chocolate', 'kit', 'vanilla']","Chocolate Lava Cake Mix This rich, moist chocolate cake makes its own hot fudge sauce. Just cut it open and enjoy the molten treasure inside. Made with King Arthur Flour, sweet chocolate, dark cocoa, and pure premium vanilla. Hot fudge flows from the center of this cake. Ready in under 20 minutes! Just add water, butter, and eggs, bake, and enjoy! Bake in standard custard cups or silicone molds. Cakes may be refrigerated or frozen in silicone molds until ready to bake. Our mixes are carefully crafted in our test kitchen through meticulous taste-testing (it's a tough job, but we're up to the challenge!) and blending to replicate our favorite recipes. The best part? We do the measuring and mixing for you. The result? Consistent deliciousness that everyone can enjoy made with simple ingredients that we bake with every day in our kitchens — no artificial colors or flavors, no preservatives, and all non-GMO. Ingredients Ingredients Ingredients Extracts & Flavorings Spices & Pantry Fruit Add-Ins & Jams Mixes Cake &amp; Pie Shop Mixes Cake &amp; Pie Chocolate Lava Cake Mix #100274"
Cinnamon Bun Mix,https://shop.kingarthurbaking.com/items/cinnamon-bun-mix,18.95,USD,"Warm, gooey cinnamon buns, made easy. It's a well-known fact that a cinnamon bun is one of the best breakfasts to grace the kitchen table, and this mix makes it all possible. Soft and fluffy with a swirl of cinnamon tucked inside and a golden top crust drizzled with vanilla glaze - it doesn't get much better (or easier!) than this. Our cinnamon bun recipe is made with only the simple, good, non-GMO ingredients you want and nothing you don't. Our mix makes it easy to bake these classic cinnamon rolls at home so you can enjoy more time around the table with loved ones.",Ingredients Ingredients Ingredients Extracts & Flavorings Spices & Pantry Fruit Add-Ins & Jams,,4.6,564,https://cdn11.bigcommerce.com/s-ihwnd7z21q/images/stencil/1280x1280/products/541/7141/100198__84649_3153__64881.1724079438.jpg?c=1,,InStock,Bread,Bread,"['Shop', 'Mixes', 'Bread', 'Cinnamon Bun Mix #100198']","['bread', 'cinnamon', 'kit', 'vanilla']","Cinnamon Bun Mix Warm, gooey cinnamon buns, made easy. It's a well-known fact that a cinnamon bun is one of the best breakfasts to grace the kitchen table, and this mix makes it all possible. Soft and fluffy with a swirl of cinnamon tucked inside and a golden top crust drizzled with vanilla glaze - it doesn't get much better (or easier!) than this. Our cinnamon bun recipe is made with only the simple, good, non-GMO ingredients you want and nothing you don't. Our mix makes it easy to bake these classic cinnamon rolls at home so you can enjoy more time around the table with loved ones. Ingredients Ingredients Ingredients Extracts & Flavorings Spices & Pantry Fruit Add-Ins & Jams Mixes Bread Shop Mixes Bread Cinnamon Bun Mix #100198"
Cinnamon Pecan Scone Mix,https://shop.kingarthurbaking.com/items/cinnamon-pecan-scone-mix,8.95,USD,"Cinnamon scones with an extra boost of pecan goodness. With our simple scone mix, fresh, homemade scones are quick and easy—ready in under 30 minutes! Made with our signature Vietnamese cinnamon, sweet cinnamon bits, and crunchy diced pecans, this mix brings irresistible flavor to every bite. Perfect for breakfast, an afternoon treat, or sharing with family and friends. Just mix, shape, and bake for warm, golden scones that fill your kitchen with the cozy scent of cinnamon and nuts.",Ingredients Ingredients Ingredients Extracts & Flavorings Spices & Pantry Fruit Add-Ins & Jams,,4.8,697,https://cdn11.bigcommerce.com/s-ihwnd7z21q/images/stencil/1280x1280/products/546/7164/100207_packagefront__22495_3303__70884.1724079442.jpg?c=1,,OutOfStock,Scones,Scones,"['Shop', 'Mixes', 'Scones', 'Cinnamon Pecan Scone Mix #100207']","['cinnamon', 'kit', 'scone']","Cinnamon Pecan Scone Mix Cinnamon scones with an extra boost of pecan goodness. With our simple scone mix, fresh, homemade scones are quick and easy—ready in under 30 minutes! Made with our signature Vietnamese cinnamon, sweet cinnamon bits, and crunchy diced pecans, this mix brings irresistible flavor to every bite. Perfect for breakfast, an afternoon treat, or sharing with family and friends. Just mix, shape, and bake for warm, golden scones that fill your kitchen with the cozy scent of cinnamon and nuts. Ingredients Ingredients Ingredients Extracts & Flavorings Spices & Pantry Fruit Add-Ins & Jams Mixes Scones Shop Mixes Scones Cinnamon Pecan Scone Mix #100207"
Classic Chewy Bagel Mix Kit,https://shop.kingarthurbaking.com/items/classic-chewy-bagel-mix-kit,9.95,USD,"Fresh-from-the-oven bagels made easy! Warm, chewy, and ready in just an hour, these homemade bagels bring bagel-shop goodness to your kitchen with ease — simply add water! Each batch makes eight bagels with a crisp, golden crust and soft, chewy interior. Delicious on their own, perfect for breakfast sandwiches, and great for customizing with mix-ins or toppings. Click on the Classic Chewy Bagels Recipe below for tips to add our Cinnamon Sweet Bits or Blueberry Jammy Bits! Makes: 8 Bagels 16 Cream Cheese-Stuffed Bagel Pockets 12 Everything Bagel Twists 24 Mini Pizza Bagels 3 cups Bagel Chips",Ingredients Ingredients Ingredients Extracts & Flavorings Spices & Pantry Fruit Add-Ins & Jams,,4.6,30,https://cdn11.bigcommerce.com/s-ihwnd7z21q/images/stencil/1280x1280/products/1830/9422/1_FOP__16232.1760106605.jpg?c=1,,InStock,Bread Mix Kits,Bread Mix Kits,"['Shop', 'Mixes', 'Bread Mix Kits', 'Classic Chewy Bagel Mix Kit #400203']","['bread', 'cinnamon', 'kit', 'pizza']","Classic Chewy Bagel Mix Kit Fresh-from-the-oven bagels made easy! Warm, chewy, and ready in just an hour, these homemade bagels bring bagel-shop goodness to your kitchen with ease — simply add water! Each batch makes eight bagels with a crisp, golden crust and soft, chewy interior. Delicious on their own, perfect for breakfast sandwiches, and great for customizing with mix-ins or toppings. Click on the Classic Chewy Bagels Recipe below for tips to add our Cinnamon Sweet Bits or Blueberry Jammy Bits! Makes: 8 Bagels 16 Cream Cheese-Stuffed Bagel Pockets 12 Everything Bagel Twists 24 Mini Pizza Bagels 3 cups Bagel Chips Ingredients Ingredients Ingredients Extracts & Flavorings Spices & Pantry Fruit Add-Ins & Jams Mixes Bread Mix Kits Shop Mixes Bread Mix Kits Classic Chewy Bagel Mix Kit #400203"
Coconut Macaroon Cookie Mix,https://shop.kingarthurbaking.com/items/coconut-macaroon-cookie-mix,8.95,USD,"Coconut macaroons made super-simple! Just add water, scoop, and bake. If you love coconut, this is your cookie. Ever so slightly toasty on the outside, moist and chewy inside, you can dress macaroons up even more by making them thumbprint style and placing a chocolate disk on top when they come out of the oven. Our mixes are carefully crafted in our test kitchen through meticulous taste-testing (it's a tough job, but we're up to the challenge!) and blending to replicate our favorite recipes. The best part? We do the measuring and mixing for you. The result? Consistent deliciousness that everyone can enjoy made with simple ingredients that we bake with every day in our kitchens — no artificial colors or flavors, no preservatives, and all non-GMO.",Ingredients Ingredients Ingredients Extracts & Flavorings Spices & Pantry Fruit Add-Ins & Jams,,4.0,1,https://cdn11.bigcommerce.com/s-ihwnd7z21q/images/stencil/1280x1280/products/1836/9609/400016-front__70620.1767724012.png?c=1,,InStock,Cookies,Cookies,"['Shop', 'Mixes', 'Cookies', 'Coconut Macaroon Cookie Mix #400016']","['chocolate', 'cookie', 'kit']","Coconut Macaroon Cookie Mix Coconut macaroons made super-simple! Just add water, scoop, and bake. If you love coconut, this is your cookie. Ever so slightly toasty on the outside, moist and chewy inside, you can dress macaroons up even more by making them thumbprint style and placing a chocolate disk on top when they come out of the oven. Our mixes are carefully crafted in our test kitchen through meticulous taste-testing (it's a tough job, but we're up to the challenge!) and blending to replicate our favorite recipes. The best part? We do the measuring and mixing for you. The result? Consistent deliciousness that everyone can enjoy made with simple ingredients that we bake with every day in our kitchens — no artificial colors or flavors, no preservatives, and all non-GMO. Ingredients Ingredients Ingredients Extracts & Flavorings Spices & Pantry Fruit Add-Ins & Jams Mixes Cookies Shop Mixes Cookies Coconut Macaroon Cookie Mix #400016"
Coffee Cake Mix,https://shop.kingarthurbaking.com/items/coffee-cake-mix,8.95,USD,"Coffee cake ready in under an hour! Warm, buttery, and filled with cinnamon goodness, this classic coffee cake delivers the comfort of a homemade treat with little effort. Inside, a thick ribbon of cinnamon swirls through the center, topped off with a generous, crunchy crumble topping. Quick and easy to bake in under an hour, this convenient mix only needs butter, eggs, and milk. Perfect for breakfast, a coffee break, or dessert, it’s the kind of cake that impresses without the fuss. Serving suggestion: finish the coffee cake with a dusting of confectioner's sugar or a vanilla glaze, if desired. &nbsp;",Ingredients Ingredients Ingredients Extracts & Flavorings Spices & Pantry Fruit Add-Ins & Jams,,5.0,2,https://cdn11.bigcommerce.com/s-ihwnd7z21q/images/stencil/1280x1280/products/1941/9740/CoffeeCake_34_022326__95202.1771860526.jpg?c=1,,InStock,Muffins &amp; Quick Bread,Muffins &amp; Quick Bread,"['Shop', 'Mixes', 'Muffins &amp; Quick Bread', 'Coffee Cake Mix #400382']","['bread', 'cake', 'cinnamon', 'muffin', 'vanilla']","Coffee Cake Mix Coffee cake ready in under an hour! Warm, buttery, and filled with cinnamon goodness, this classic coffee cake delivers the comfort of a homemade treat with little effort. Inside, a thick ribbon of cinnamon swirls through the center, topped off with a generous, crunchy crumble topping. Quick and easy to bake in under an hour, this convenient mix only needs butter, eggs, and milk. Perfect for breakfast, a coffee break, or dessert, it’s the kind of cake that impresses without the fuss. Serving suggestion: finish the coffee cake with a dusting of confectioner's sugar or a vanilla glaze, if desired. &nbsp; Ingredients Ingredients Ingredients Extracts & Flavorings Spices & Pantry Fruit Add-Ins & Jams Mixes Muffins &amp; Quick Bread Shop Mixes Muffins &amp; Quick Bread Coffee Cake Mix #400382"
Country Blueberry Muffin and Quick Bread Mix,https://shop.kingarthurbaking.com/items/country-blueberry-muffin-and-quick-bread-mix,8.95,USD,"Our take on classic blueberry muffins. This mix is made with buttermilk for an even more tender crumb and delectable taste. Bursting with flavor and packed with dried blueberries in every bite, these muffins satisfy every breakfast craving. Our mixes are carefully crafted in our test kitchen through meticulous taste-testing (it's a tough job, but we're up to the challenge!) and blending to replicate our favorite recipes. The best part? We do the measuring and mixing for you. The result? Consistent deliciousness that everyone can enjoy made with simple ingredients that we bake with every day in our kitchens — no artificial colors or flavors, no preservatives, and all non-GMO.",Ingredients Ingredients Ingredients Extracts & Flavorings Spices & Pantry Fruit Add-Ins & Jams,,4.4,458,https://cdn11.bigcommerce.com/s-ihwnd7z21q/images/stencil/1280x1280/products/582/7344/100303_front__05932_3323__37672.1724079445.jpg?c=1,,OutOfStock,Doughnuts &amp; Muffins,Doughnuts &amp; Muffins,"['Shop', 'Mixes', 'Doughnuts &amp; Muffins', 'Country Blueberry Muffin and Quick Bread Mix #100303']","['bread', 'kit', 'muffin']","Country Blueberry Muffin and Quick Bread Mix Our take on classic blueberry muffins. This mix is made with buttermilk for an even more tender crumb and delectable taste. Bursting with flavor and packed with dried blueberries in every bite, these muffins satisfy every breakfast craving. Our mixes are carefully crafted in our test kitchen through meticulous taste-testing (it's a tough job, but we're up to the challenge!) and blending to replicate our favorite recipes. The best part? We do the measuring and mixing for you. The result? Consistent deliciousness that everyone can enjoy made with simple ingredients that we bake with every day in our kitchens — no artificial colors or flavors, no preservatives, and all non-GMO. Ingredients Ingredients Ingredients Extracts & Flavorings Spices & Pantry Fruit Add-Ins & Jams Mixes Doughnuts &amp; Muffins Shop Mixes Doughnuts &amp; Muffins Country Blueberry Muffin and Quick Bread Mix #100303"
Cran-Raspberry White Chocolate Scone Mix,https://shop.kingarthurbaking.com/items/cran-raspberry-white-chocolate-scone-mix,8.95,USD,"Cranberries and raspberries and white chocolate - oh my! These berry scones are a guaranteed showstopper. Our tender, buttery scones are studded with tangy dried cranberries, creamy white chocolate chips, and sweet, chewy raspberry jammy bits. Freshly baked homemade scones are quick and easy with our simple scone mixes. Perfect for serving at breakfast, an afternoon snack, for yourself, your family, or your guests. Simply blend, shape, and bake for warm, delicious scones in fewer than 30 minutes.",Ingredients Ingredients Ingredients Extracts & Flavorings Spices & Pantry Fruit Add-Ins & Jams,,4.9,671,https://cdn11.bigcommerce.com/s-ihwnd7z21q/images/stencil/1280x1280/products/556/7209/100218_packagefront__75234_3300__93064.1724079436.jpg?c=1,,InStock,Scones,Scones,"['Shop', 'Mixes', 'Scones', 'Cran-Raspberry White Chocolate Scone Mix #100218']","['chocolate', 'scone']","Cran-Raspberry White Chocolate Scone Mix Cranberries and raspberries and white chocolate - oh my! These berry scones are a guaranteed showstopper. Our tender, buttery scones are studded with tangy dried cranberries, creamy white chocolate chips, and sweet, chewy raspberry jammy bits. Freshly baked homemade scones are quick and easy with our simple scone mixes. Perfect for serving at breakfast, an afternoon snack, for yourself, your family, or your guests. Simply blend, shape, and bake for warm, delicious scones in fewer than 30 minutes. Ingredients Ingredients Ingredients Extracts & Flavorings Spices & Pantry Fruit Add-Ins & Jams Mixes Scones Shop Mixes Scones Cran-Raspberry White Chocolate Scone Mix #100218"
Cranberry-Orange Muffin and Quick Bread Mix,https://shop.kingarthurbaking.com/items/cranberry-orange-muffin-and-quick-bread-mix,8.95,USD,"Cranberry-Orange Muffins made with buttermilk for an even more tender crumb and delectable flavor. Tart-sweet cranberries mingle with a hint of bright orange flavor in every bite of these moist muffins. They please every crowd, whether it's a Sunday morning family breakfast to or a weekday lunchbox snack. Or use the same mix to whip up a quick loaf of Cranberry-Orange Bread! Our mixes are carefully crafted in our test kitchen through meticulous taste-testing (it's a tough job, but we're up to the challenge!) and blending to replicate our favorite recipes. The best part? We do the measuring and mixing for you. The result? Consistent deliciousness that everyone can enjoy made with simple ingredients that we bake with every day in our kitchens — no artificial colors or flavors, no preservatives, and all non-GMO.",Ingredients Ingredients Ingredients Extracts & Flavorings Spices & Pantry Fruit Add-Ins & Jams,,4.4,533,https://cdn11.bigcommerce.com/s-ihwnd7z21q/images/stencil/1280x1280/products/860/3312/100305_front__19537.1724079455.jpg?c=1,,OutOfStock,Doughnuts &amp; Muffins,Doughnuts &amp; Muffins,"['Shop', 'Mixes', 'Doughnuts &amp; Muffins', 'Cranberry-Orange Muffin and Quick Bread Mix #100305']","['bread', 'kit', 'muffin']","Cranberry-Orange Muffin and Quick Bread Mix Cranberry-Orange Muffins made with buttermilk for an even more tender crumb and delectable flavor. Tart-sweet cranberries mingle with a hint of bright orange flavor in every bite of these moist muffins. They please every crowd, whether it's a Sunday morning family breakfast to or a weekday lunchbox snack. Or use the same mix to whip up a quick loaf of Cranberry-Orange Bread! Our mixes are carefully crafted in our test kitchen through meticulous taste-testing (it's a tough job, but we're up to the challenge!) and blending to replicate our favorite recipes. The best part? We do the measuring and mixing for you. The result? Consistent deliciousness that everyone can enjoy made with simple ingredients that we bake with every day in our kitchens — no artificial colors or flavors, no preservatives, and all non-GMO. Ingredients Ingredients Ingredients Extracts & Flavorings Spices & Pantry Fruit Add-Ins & Jams Mixes Doughnuts &amp; Muffins Shop Mixes Doughnuts &amp; Muffins Cranberry-Orange Muffin and Quick Bread Mix #100305"
Cranberry-Orange Scone Mix,https://shop.kingarthurbaking.com/items/cranberry-orange-scone-mix,8.95,USD,"Make Cranberry-Orange Scones in a pinch with our best-selling mix. Bring the tangy taste of cranberries and the zestiness of oranges to the table with our Cranberry-Orange Scone Mix! Deliciously flaky and tender with bright citrus flavor and pops of juicy berries - it's no surprise this is our #1 selling mix! Freshly baked homemade scones are quick and easy with our simple scone mixes. Perfect for serving at breakfast, an afternoon snack, for yourself, your family, or your guests. Simply blend, shape, and bake for warm, delicious scones in fewer than 30 minutes.",Ingredients Ingredients Ingredients Extracts & Flavorings Spices & Pantry Fruit Add-Ins & Jams,,4.8,1536,https://cdn11.bigcommerce.com/s-ihwnd7z21q/images/stencil/1280x1280/products/548/7173/100209__73660_3097__35536.1724079446.jpg?c=1,,InStock,Scones,Scones,"['Shop', 'Mixes', 'Scones', 'Cranberry-Orange Scone Mix #100209']",['scone'],"Cranberry-Orange Scone Mix Make Cranberry-Orange Scones in a pinch with our best-selling mix. Bring the tangy taste of cranberries and the zestiness of oranges to the table with our Cranberry-Orange Scone Mix! Deliciously flaky and tender with bright citrus flavor and pops of juicy berries - it's no surprise this is our #1 selling mix! Freshly baked homemade scones are quick and easy with our simple scone mixes. Perfect for serving at breakfast, an afternoon snack, for yourself, your family, or your guests. Simply blend, shape, and bake for warm, delicious scones in fewer than 30 minutes. Ingredients Ingredients Ingredients Extracts & Flavorings Spices & Pantry Fruit Add-Ins & Jams Mixes Scones Shop Mixes Scones Cranberry-Orange Scone Mix #100209"
