name,url,price,currency,description,ingredients,size,rating,review_count,image_url,brand,availability,category,subcategory,breadcrumbs,tags,search_text
Loaded Potato Soup,https://shop.kingarthurbaking.com/items/loaded-potato-soup,9.95,USD,"The quick and easy shortcut to delicious homemade soup. If we're not cooking from scratch, we're mixing up delicious soups from Frontier's convenient mixes. Made with the finest natural ingredients, no added salt, no preservatives or MSG, you can taste the difference — our families and friends always ask for the recipe! This customer-loved mix makes a creamy, chunky, and indulgent family favorite with wonderfully savory flavors. Just add bacon, chicken broth, potatoes, and heavy cream and you've got a steaming hot, homemade soup.",Ingredients Ingredients Ingredients Extracts & Flavorings Spices & Pantry Fruit Add-Ins & Jams,,4.3,161,https://cdn11.bigcommerce.com/s-ihwnd7z21q/images/stencil/1280x1280/products/296/6380/loaded-potato-soup-1__17007_1886__24063.1724079434.jpg?c=1,,InStock,Specialty,Specialty,"['Shop', 'Mixes', 'Specialty', 'Loaded Potato Soup #209393']",[],"Loaded Potato Soup The quick and easy shortcut to delicious homemade soup. If we're not cooking from scratch, we're mixing up delicious soups from Frontier's convenient mixes. Made with the finest natural ingredients, no added salt, no preservatives or MSG, you can taste the difference — our families and friends always ask for the recipe! This customer-loved mix makes a creamy, chunky, and indulgent family favorite with wonderfully savory flavors. Just add bacon, chicken broth, potatoes, and heavy cream and you've got a steaming hot, homemade soup. Ingredients Ingredients Ingredients Extracts & Flavorings Spices & Pantry Fruit Add-Ins & Jams Mixes Specialty Shop Mixes Specialty Loaded Potato Soup #209393"
Mini Cran-Raspberry White Chocolate Scone Set,https://shop.kingarthurbaking.com/items/mini-cran-raspberry-white-chocolate-scone-set,61.61,USD,"Bake mini cranberry raspberry white chocolate scones with ease. This convenient set combines our flavorful scone mix with a nonstick Mini Scone Pan to make perfectly portioned 3-bite scones. Our scone mix features tangy dried cranberries, creamy white chocolate chips, and sweet raspberry Jammy Bits, delivering a delightful burst of berry flavor in every bite. Sprinkle with Sparkling Sugar for an extra crunch and shimmer. See all Special Savings»",Ingredients Ingredients Ingredients Extracts & Flavorings Spices & Pantry Fruit Add-Ins & Jams,,,,https://cdn11.bigcommerce.com/s-ihwnd7z21q/images/stencil/1280x1280/products/1851/9364/400230_1__95185.1759517856.jpg?c=1,,InStock,Mix &amp; Pan Sets,Mix &amp; Pan Sets,"['Shop', 'Pans', 'Mix &amp; Pan Sets', 'Mini Cran-Raspberry White Chocolate Scone Set #400230']","['chocolate', 'scone']","Mini Cran-Raspberry White Chocolate Scone Set Bake mini cranberry raspberry white chocolate scones with ease. This convenient set combines our flavorful scone mix with a nonstick Mini Scone Pan to make perfectly portioned 3-bite scones. Our scone mix features tangy dried cranberries, creamy white chocolate chips, and sweet raspberry Jammy Bits, delivering a delightful burst of berry flavor in every bite. Sprinkle with Sparkling Sugar for an extra crunch and shimmer. See all Special Savings» Ingredients Ingredients Ingredients Extracts & Flavorings Spices & Pantry Fruit Add-Ins & Jams Pans Mix &amp; Pan Sets Shop Pans Mix &amp; Pan Sets Mini Cran-Raspberry White Chocolate Scone Set #400230"
Multigrain Bread Mix,https://shop.kingarthurbaking.com/items/multigrain-bread-mix,7.95,USD,Multiple reasons to love multigrain. Our multigrain bread mix makes a wholesome and hearty loaf with great texture and flavor. It's made with our own Super 10 Blend and All-Purpose Flour for a nutrient-packed loaf with ancient whole grains. Video: How to knead bread dough Video: How to tell if bread dough is fully kneaded,Ingredients Ingredients Ingredients Extracts & Flavorings Spices & Pantry Fruit Add-Ins & Jams,½-lb,4.7,562,https://cdn11.bigcommerce.com/s-ihwnd7z21q/images/stencil/1280x1280/products/718/7851/207415__66787_3162__39231.1724079453.jpg?c=1,,OutOfStock,Bread,Bread,"['Shop', 'Mixes', 'Bread', 'Multigrain Bread Mix #207415']",['bread'],Multigrain Bread Mix Multiple reasons to love multigrain. Our multigrain bread mix makes a wholesome and hearty loaf with great texture and flavor. It's made with our own Super 10 Blend and All-Purpose Flour for a nutrient-packed loaf with ancient whole grains. Video: How to knead bread dough Video: How to tell if bread dough is fully kneaded Ingredients Ingredients Ingredients Extracts & Flavorings Spices & Pantry Fruit Add-Ins & Jams Mixes Bread Shop Mixes Bread Multigrain Bread Mix #207415
Outrageous Chocolate Chip Cookie Mix,https://shop.kingarthurbaking.com/items/outrageous-chocolate-chip-cookie-mix,9.95,USD,"Best ever Chocolate Chip Cookies at your fingertips! King Arthur mixes make homemade easy and oh-so delicious. These delightful cookies are LOADED with chocolate, guaranteed to satisfy any sweet craving. Outrageous Chocolate Chip Cookies Mix features bittersweet and semisweet chocolate chips, plus delicious semisweet chocolate chunks, all nestled in a buttery, vanilla-scented cookie. With our mix in your pantry, you're only an egg and some butter away from the irresistible taste of warm, buttery, chocolate chip cookies. Our mixes are carefully crafted in our test kitchen through meticulous taste-testing (it's a tough job, but we're up to the challenge!) and blending to replicate our favorite recipes. The best part? We do the measuring and mixing for you. The result? Consistent deliciousness that everyone can enjoy made with simple ingredients that we bake with every day in our kitchens — no artificial colors or flavors, no preservatives, and all non-GMO.",Ingredients Ingredients Ingredients Extracts & Flavorings Spices & Pantry Fruit Add-Ins & Jams,,4.7,735,https://cdn11.bigcommerce.com/s-ihwnd7z21q/images/stencil/1280x1280/products/600/7429/101123_front__16027_3311__99859.1724079453.jpg?c=1,,InStock,Cookies,Cookies,"['Shop', 'Mixes', 'Cookies', 'Outrageous Chocolate Chip Cookie Mix #101123']","['chocolate', 'cookie', 'kit', 'vanilla']","Outrageous Chocolate Chip Cookie Mix Best ever Chocolate Chip Cookies at your fingertips! King Arthur mixes make homemade easy and oh-so delicious. These delightful cookies are LOADED with chocolate, guaranteed to satisfy any sweet craving. Outrageous Chocolate Chip Cookies Mix features bittersweet and semisweet chocolate chips, plus delicious semisweet chocolate chunks, all nestled in a buttery, vanilla-scented cookie. With our mix in your pantry, you're only an egg and some butter away from the irresistible taste of warm, buttery, chocolate chip cookies. Our mixes are carefully crafted in our test kitchen through meticulous taste-testing (it's a tough job, but we're up to the challenge!) and blending to replicate our favorite recipes. The best part? We do the measuring and mixing for you. The result? Consistent deliciousness that everyone can enjoy made with simple ingredients that we bake with every day in our kitchens — no artificial colors or flavors, no preservatives, and all non-GMO. Ingredients Ingredients Ingredients Extracts & Flavorings Spices & Pantry Fruit Add-Ins & Jams Mixes Cookies Shop Mixes Cookies Outrageous Chocolate Chip Cookie Mix #101123"
Pancake Art Kit,https://shop.kingarthurbaking.com/items/pancake-art-kit,37.67,USD,"Because breakfast should never be boring! Bring creativity to the breakfast table with the Color Pancake Art Set! This all-in-one set has the essentials to make light and fluffy, colorful pancakes! Made with vibrant Plant-Based Food Colors derived from natural ingredients — no artificial dyes here — you can flip up countless pancakes with a feel-good twist. Perfect for weekend mornings, birthday breakfasts, or any time you want to add a little whimsy to your stack. Start with simple designs (like shapes, clouds, hearts, and smiley faces), then experiment with more intricate and creative designs as you get comfortable! Goes great with Zojirushi Gourmet Sizzler Electric Griddle!",Ingredients Ingredients Ingredients Extracts & Flavorings Spices & Pantry Fruit Add-Ins & Jams,,4.0,5,https://cdn11.bigcommerce.com/s-ihwnd7z21q/images/stencil/1280x1280/products/1804/9457/400080__67461.1760727240.jpg?c=1,,InStock,Pancakes,Pancakes,"['Shop', 'Mixes', 'Pancakes', 'Pancake Art Kit #400080']","['cake', 'kit', 'pancake']","Pancake Art Kit Because breakfast should never be boring! Bring creativity to the breakfast table with the Color Pancake Art Set! This all-in-one set has the essentials to make light and fluffy, colorful pancakes! Made with vibrant Plant-Based Food Colors derived from natural ingredients — no artificial dyes here — you can flip up countless pancakes with a feel-good twist. Perfect for weekend mornings, birthday breakfasts, or any time you want to add a little whimsy to your stack. Start with simple designs (like shapes, clouds, hearts, and smiley faces), then experiment with more intricate and creative designs as you get comfortable! Goes great with Zojirushi Gourmet Sizzler Electric Griddle! Ingredients Ingredients Ingredients Extracts & Flavorings Spices & Pantry Fruit Add-Ins & Jams Mixes Pancakes Shop Mixes Pancakes Pancake Art Kit #400080"
Peaches & Cream Scone Mix,https://shop.kingarthurbaking.com/items/peaches-cream-scone-mix,8.95,USD,"Tender, buttery peach scones, made easy! Made with the finest cream and packed with chewy Peach Jammy Bits, these scones are tender, buttery, and full of bright, sweet flavor. Our mix makes it quick and easy to whip up a batch — just blend, shape, and bake for warm, delicious scones in under 30 minutes. Perfect for breakfast, an afternoon snack, or sharing with family and friends.",Ingredients Ingredients Ingredients Extracts & Flavorings Spices & Pantry Fruit Add-Ins & Jams,,4.8,683,https://cdn11.bigcommerce.com/s-ihwnd7z21q/images/stencil/1280x1280/products/555/7205/100216_front__50360_3333__61469.1724079435.jpg?c=1,,OutOfStock,Scones,Scones,"['Shop', 'Mixes', 'Scones', 'Peaches &amp; Cream Scone Mix #100216']",['scone'],"Peaches & Cream Scone Mix Tender, buttery peach scones, made easy! Made with the finest cream and packed with chewy Peach Jammy Bits, these scones are tender, buttery, and full of bright, sweet flavor. Our mix makes it quick and easy to whip up a batch — just blend, shape, and bake for warm, delicious scones in under 30 minutes. Perfect for breakfast, an afternoon snack, or sharing with family and friends. Ingredients Ingredients Ingredients Extracts & Flavorings Spices & Pantry Fruit Add-Ins & Jams Mixes Scones Shop Mixes Scones Peaches &amp; Cream Scone Mix #100216"
Perfect Popovers Set,https://shop.kingarthurbaking.com/items/perfect-popovers-set,81.56,USD,"Essentials for perfect popovers! With this pan, mix, and scoop set, anyone can bake hot, buttery, crisp, light-as-air popovers (everyone's favorite bread-basket treat!) at home. Use the scoop to get just the right amount of batter for each well (and to scoop more easily and efficiently). Standard popover pan yields delicious results. Six separate wells are connected only at their rims, so oven-hot air circulates freely between them, with sufficient space between each well so they don't crowd. The result? Loftier, higher rising popovers that dome 5"" above the pan! Handles on each end of the pan keep popovers safe from bulky oven mitts as you transport them to your dinner table. The durable cast aluminum pan offers superior baking performance. The pan's shiny finish reflects heat to prevent over-browning of the exterior of your popovers. Nonstick coating helps your popovers release cleanly from the pan. Minneapolis' family-owned Nordic Ware company makes this pan right here in the USA.",Ingredients Ingredients Ingredients Extracts & Flavorings Spices & Pantry Fruit Add-Ins & Jams,,4.8,61,https://cdn11.bigcommerce.com/s-ihwnd7z21q/images/stencil/1280x1280/products/307/9238/209530-Perfect-Pop-Over-Set__81998.1756304590.jpg?c=1,,OutOfStock,Sets,Sets,"['Shop', 'Sale &amp; Savings', 'Sets', 'Perfect Popovers Set #209530']",['bread'],"Perfect Popovers Set Essentials for perfect popovers! With this pan, mix, and scoop set, anyone can bake hot, buttery, crisp, light-as-air popovers (everyone's favorite bread-basket treat!) at home. Use the scoop to get just the right amount of batter for each well (and to scoop more easily and efficiently). Standard popover pan yields delicious results. Six separate wells are connected only at their rims, so oven-hot air circulates freely between them, with sufficient space between each well so they don't crowd. The result? Loftier, higher rising popovers that dome 5"" above the pan! Handles on each end of the pan keep popovers safe from bulky oven mitts as you transport them to your dinner table. The durable cast aluminum pan offers superior baking performance. The pan's shiny finish reflects heat to prevent over-browning of the exterior of your popovers. Nonstick coating helps your popovers release cleanly from the pan. Minneapolis' family-owned Nordic Ware company makes this pan right here in the USA. Ingredients Ingredients Ingredients Extracts & Flavorings Spices & Pantry Fruit Add-Ins & Jams Sale &amp; Savings Sets Shop Sale &amp; Savings Sets Perfect Popovers Set #209530"
Perfectly Tender Flatbread Mix Kit,https://shop.kingarthurbaking.com/items/perfectly-tender-flatbread-mix-kit,7.95,USD,"Experience the joy of bread baking with our Perfectly Tender Flatbread Mix Kit! In a hurry? Or just hungry? In just about an hour, you can enjoy soft and flavorful flatbread, ideal for crafting savory sandwiches or creating restaurant-quality turnovers in the comfort of your kitchen! Our comprehensive kit includes all the essentials: a flatbread mix, yeast packet, and a flavorful za'atar herb blend, ensuring a convenient and delightful baking experience. Simply add water and oil to the mix, follow instructions, and you're ready to go! From the recipe on the back of the box to new recipes online, there are plenty of ways to let your creativity shine. Flatbread can be frozen for ultimate convenience. Bake, cool completely, transfer to an airtight container, and store in your freezer for later. Placing a piece of parchment between flatbreads will make it easier to take out one at a time and reheat individually. See our blog post for more bread-freezing and thawing tips. Makes: Eight 6”...",Ingredients Ingredients Ingredients Extracts & Flavorings Spices & Pantry Fruit Add-Ins & Jams,,4.6,74,https://cdn11.bigcommerce.com/s-ihwnd7z21q/images/stencil/1280x1280/products/1519/5720/213187__85207.1724079470.jpg?c=1,,InStock,Bread,Bread,"['Shop', 'Mixes', 'Bread', 'Perfectly Tender Flatbread Mix Kit #213187']","['bread', 'kit']","Perfectly Tender Flatbread Mix Kit Experience the joy of bread baking with our Perfectly Tender Flatbread Mix Kit! In a hurry? Or just hungry? In just about an hour, you can enjoy soft and flavorful flatbread, ideal for crafting savory sandwiches or creating restaurant-quality turnovers in the comfort of your kitchen! Our comprehensive kit includes all the essentials: a flatbread mix, yeast packet, and a flavorful za'atar herb blend, ensuring a convenient and delightful baking experience. Simply add water and oil to the mix, follow instructions, and you're ready to go! From the recipe on the back of the box to new recipes online, there are plenty of ways to let your creativity shine. Flatbread can be frozen for ultimate convenience. Bake, cool completely, transfer to an airtight container, and store in your freezer for later. Placing a piece of parchment between flatbreads will make it easier to take out one at a time and reheat individually. See our blog post for more bread-freezing and thawing tips. Makes: Eight 6”... Ingredients Ingredients Ingredients Extracts & Flavorings Spices & Pantry Fruit Add-Ins & Jams Mixes Bread Shop Mixes Bread Perfectly Tender Flatbread Mix Kit #213187"
Popover Mix,https://shop.kingarthurbaking.com/items/popover-mix,7.95,USD,"Makes light, airy ""puffs"" with a golden brown exterior. Our Popover Mix makes it easy to enjoy fresh, golden popovers straight from your oven. Light, airy, and perfectly crisp on the outside, they’re a delight at any meal. Serve them at breakfast with jam or honey, pair them with butter for dinner, or get creative with sweet or savory toppings. Fluffy, warm, and irresistible, these popovers are a simple way to bring a touch of bakery magic into your home.",Ingredients Ingredients Ingredients Extracts & Flavorings Spices & Pantry Fruit Add-Ins & Jams,,4.8,904,https://cdn11.bigcommerce.com/s-ihwnd7z21q/images/stencil/1280x1280/products/1263/4922/07400_front__93748__90634.1724079464.jpg?c=1,,InStock,Bread,Bread,"['Shop', 'Mixes', 'Bread', 'Popover Mix #307400']",['bread'],"Popover Mix Makes light, airy ""puffs"" with a golden brown exterior. Our Popover Mix makes it easy to enjoy fresh, golden popovers straight from your oven. Light, airy, and perfectly crisp on the outside, they’re a delight at any meal. Serve them at breakfast with jam or honey, pair them with butter for dinner, or get creative with sweet or savory toppings. Fluffy, warm, and irresistible, these popovers are a simple way to bring a touch of bakery magic into your home. Ingredients Ingredients Ingredients Extracts & Flavorings Spices & Pantry Fruit Add-Ins & Jams Mixes Bread Shop Mixes Bread Popover Mix #307400"
Pull-Apart Garlic Bread Mix Kit,https://shop.kingarthurbaking.com/items/pull-apart-garlic-bread-mix-kit,7.95,USD,"Experience the joy of bread baking with our Pull-Apart Garlic Bread Mix Kit! Baking fresh Pull-Apart Garlic Bread has never been easier or faster! In just about an hour, you can enjoy the irresistible delight of cheesy Pull-Apart Garlic Bread with the help of our convenient mix kit! This tender treat is filled with a savory blend of herby, buttery goodness, making it the perfect accompaniment to any meal or a satisfying snack on its own. Our convenient kit includes the essentials: a pull-apart bread mix, yeast packet, and garlic bread seasoning, ensuring a hassle-free baking experience. Simply add water and butter to the mix, and you're on your way to enjoying warm, garlic-bread perfection straight from your oven. From the recipe on the back of the box to new recipes online, there are plenty of ways to let your creativity shine! Try new toppings and fillings, like caramelized onions, cured meats, and sautéed vegetables. To make this mix even more time efficient, allow the dough to...",Ingredients Ingredients Ingredients Extracts & Flavorings Spices & Pantry Fruit Add-Ins & Jams,,4.3,277,https://cdn11.bigcommerce.com/s-ihwnd7z21q/images/stencil/1280x1280/products/1517/5718/213186__80216.1724079468.jpg?c=1,,InStock,Bread,Bread,"['Shop', 'Mixes', 'Bread', 'Pull-Apart Garlic Bread Mix Kit #213186']","['bread', 'kit']","Pull-Apart Garlic Bread Mix Kit Experience the joy of bread baking with our Pull-Apart Garlic Bread Mix Kit! Baking fresh Pull-Apart Garlic Bread has never been easier or faster! In just about an hour, you can enjoy the irresistible delight of cheesy Pull-Apart Garlic Bread with the help of our convenient mix kit! This tender treat is filled with a savory blend of herby, buttery goodness, making it the perfect accompaniment to any meal or a satisfying snack on its own. Our convenient kit includes the essentials: a pull-apart bread mix, yeast packet, and garlic bread seasoning, ensuring a hassle-free baking experience. Simply add water and butter to the mix, and you're on your way to enjoying warm, garlic-bread perfection straight from your oven. From the recipe on the back of the box to new recipes online, there are plenty of ways to let your creativity shine! Try new toppings and fillings, like caramelized onions, cured meats, and sautéed vegetables. To make this mix even more time efficient, allow the dough to... Ingredients Ingredients Ingredients Extracts & Flavorings Spices & Pantry Fruit Add-Ins & Jams Mixes Bread Shop Mixes Bread Pull-Apart Garlic Bread Mix Kit #213186"
Pumpkin Spice Doughnut Mix,https://shop.kingarthurbaking.com/items/pumpkin-spice-doughnut-mix,8.95,USD,"Mouthwatering, lightly spicy pumpkin doughnuts will have you dreaming of fall, all year round. These delicious doughnuts are BAKED, not deep-fried, so you can enjoy this classic treat guilt-free. Find out just how delicious a baked doughnut can be! Simply blend with your own fresh ingredients, spoon into doughnut pan, and bake. Bake tender pumpkin doughnuts with our easy-to-use mix, then finish them with melted Valhrona dark chocolate for a stunning dessert. Our mixes are carefully crafted in our test kitchen through meticulous taste-testing (it's a tough job, but we're up to the challenge!) and blending to replicate our favorite recipes. The best part? We do the measuring and mixing for you. The result? Consistent deliciousness that everyone can enjoy made with simple ingredients that we bake with every day in our kitchens — no artificial colors or flavors, no preservatives, and all non-GMO.",Ingredients Ingredients Ingredients Extracts & Flavorings Spices & Pantry Fruit Add-Ins & Jams,,4.7,423,https://cdn11.bigcommerce.com/s-ihwnd7z21q/images/stencil/1280x1280/products/601/9796/101161_FoP__51769.1773252658.jpg?c=1,,InStock,Doughnuts &amp; Muffins,Doughnuts &amp; Muffins,"['Shop', 'Mixes', 'Doughnuts &amp; Muffins', 'Pumpkin Spice Doughnut Mix #101161']","['chocolate', 'kit', 'muffin']","Pumpkin Spice Doughnut Mix Mouthwatering, lightly spicy pumpkin doughnuts will have you dreaming of fall, all year round. These delicious doughnuts are BAKED, not deep-fried, so you can enjoy this classic treat guilt-free. Find out just how delicious a baked doughnut can be! Simply blend with your own fresh ingredients, spoon into doughnut pan, and bake. Bake tender pumpkin doughnuts with our easy-to-use mix, then finish them with melted Valhrona dark chocolate for a stunning dessert. Our mixes are carefully crafted in our test kitchen through meticulous taste-testing (it's a tough job, but we're up to the challenge!) and blending to replicate our favorite recipes. The best part? We do the measuring and mixing for you. The result? Consistent deliciousness that everyone can enjoy made with simple ingredients that we bake with every day in our kitchens — no artificial colors or flavors, no preservatives, and all non-GMO. Ingredients Ingredients Ingredients Extracts & Flavorings Spices & Pantry Fruit Add-Ins & Jams Mixes Doughnuts &amp; Muffins Shop Mixes Doughnuts &amp; Muffins Pumpkin Spice Doughnut Mix #101161"
Pumpkin Spice Scone Mix,https://shop.kingarthurbaking.com/items/pumpkin-spice-whole-grain-scone-mix,8.95,USD,"Pumpkin scones packed with flavor and the goodness of whole grains. Made with real pumpkin, our finest ginger, a touch of molasses, and spiced with cinnamon, clove, and nutmeg, our Pumpkin Spice Scone Mix will have you dreaming of fall all year long. Freshly baked homemade scones are quick and easy with our simple scone mixes. Perfect for serving at breakfast, an afternoon snack, for yourself, your family, or your guests. Simply blend, shape, and bake for warm, delicious scones in fewer than 30 minutes.",Ingredients Ingredients Ingredients Extracts & Flavorings Spices & Pantry Fruit Add-Ins & Jams,,4.6,634,https://cdn11.bigcommerce.com/s-ihwnd7z21q/images/stencil/1280x1280/products/551/7186/100212M404I_211550_PumpkinSpiceScone_0421-34__45034_3034__10467.1724079449.jpg?c=1,,OutOfStock,Scones,Scones,"['Shop', 'Mixes', 'Scones', 'Pumpkin Spice Scone Mix #100212']","['cinnamon', 'scone']","Pumpkin Spice Scone Mix Pumpkin scones packed with flavor and the goodness of whole grains. Made with real pumpkin, our finest ginger, a touch of molasses, and spiced with cinnamon, clove, and nutmeg, our Pumpkin Spice Scone Mix will have you dreaming of fall all year long. Freshly baked homemade scones are quick and easy with our simple scone mixes. Perfect for serving at breakfast, an afternoon snack, for yourself, your family, or your guests. Simply blend, shape, and bake for warm, delicious scones in fewer than 30 minutes. Ingredients Ingredients Ingredients Extracts & Flavorings Spices & Pantry Fruit Add-Ins & Jams Mixes Scones Shop Mixes Scones Pumpkin Spice Scone Mix #100212"
